Source_Urls,Company_Name,Service_Type,Service_Description,Phone_No,Email,Company_Website
http://www.yellowpages.com.au/qld/yatala/go2print-14009924-listing.html?context=businessTypeSearch,go2print,"Printers & Printing Services - Yatala, QLD",Mobile Service Operating in the Area | Over 30 Year's Experience,(07) 3841 5552,Email sales@go2print.com.au,http://www.go2print.com.au (opens in a new window)
http://www.yellowpages.com.au/nsw/mayfield-west/ncp-printing-15546190-listing.html?context=businessTypeSearch,,,,,,
http://www.yellowpages.com.au/qld/townsville/fuji-xerox-business-centre-13701736-listing.html?context=businessTypeSearch,Fuji Xerox Business Centre,"Printers & Printing Services - Townsville, QLD","Photocopiers, Printers, Faxes, PC & iMac, Computer Support & Copy Shop",(07) 4774 2212,Email sales@xrx.com.au,www.xrx.com.au (opens in a new window)
http://www.yellowpages.com.au/nsw/mayfield-west/who-printing-14953003-listing.html?context=businessTypeSearch,WHO Printing,"Printers & Printing Services - Mayfield West, NSW",We Can Handle All Your Needs Today.,(02) 4915 3050,Email who@whoprinting.com.au,www.whoprinting.com.au (opens in a new window)
http://www.yellowpages.com.au/act/braddon/bytes-n-colours-13153429-listing.html?context=businessTypeSearch,Bytes 'N Colours,"Printers & Printing Services - Braddon, ACT","From Business Cards To Billboards, We Design And Print It All",(02) 6257 7266,Email frontdesk@bytesncolours.com.au,www.bytesncolours.com.au (opens in a new window)
http://www.yellowpages.com.au/sa/kent-town/peacock-design-print-14928818-listing.html?context=businessTypeSearch,Peacock Design & Print,"Printers & Printing Services - Kent Town, SA",We love to letterpress,(08) 8363 5436,Email contact@peacockdp.com.au,www.peacockdp.com.au (opens in a new window)
http://www.yellowpages.com.au/qld/rosslea/printworx-13008093-listing.html?context=businessTypeSearch,Printworx,"Printers & Printing Services - Rosslea, QLD","We're a Townsville operated & owned, one stop printing establishment.",(07) 4779 0200,Email sales@printworx.com.au,www.printworx.com.au (opens in a new window)
http://www.yellowpages.com.au/nsw/penrith/taylor-print-pty-ltd-14783975-listing.html?context=businessTypeSearch,Taylor Print Pty Ltd,"Printers & Printing Services - Penrith, NSW",One Stop Print Shop For All Your Printing & Design Needs-Solar Powered,(02) 4732 2333,Email info@taylorprint.com.au,http://www.taylorprint.com.au (opens in a new window)
http://www.yellowpages.com.au/sa/mt-barker/adelaide-hills-colour-print-bureau-12309568-listing.html?context=businessTypeSearch,Adelaide Hills Colour Print Bureau,"Printers & Printing Services - Mt Barker, SA","Digital Printing, Copy & Design!",(08) 8391 2466,Email sales@hillscolourprinting.com,www.hillscolourprinting.com (opens in a new window)
http://www.yellowpages.com.au/tas/devonport/impress-print-15292926-listing.html?context=businessTypeSearch,,,,,,
http://dataprotection.sensis.com.au/,,,,,,
